{
  "kind": "twisty-authoring-project",
  "projectVersion": 1,
  "id": "cell24",
  "producer": {
    "type": "source",
    "package": "../../../packages/cell24/package.json",
    "realizations": [
      {
        "id": "cell24-s3",
        "path": "../../../packages/cell24/cell24-s3.json"
      }
    ]
  },
  "includeLegacy": false,
  "output": "../../../runtime-puzzles/cell24",
  "presentation": {
    "version": 1,
    "defaultAlgorithm": "Xp_fXYZ Yp_vX (Xp_fXYZ Yp_vX)'"
  }
}
