{
  "kind": "twisty-authoring-project",
  "projectVersion": 1,
  "id": "flat-klein-bottle",
  "producer": {
    "type": "source",
    "package": "../../../packages/flat-klein-bottle/package.json",
    "realizations": [
      {
        "id": "flat-quotient",
        "path": "../../../packages/flat-klein-bottle/flat-quotient.json"
      }
    ]
  },
  "includeLegacy": false,
  "output": "../../../runtime-puzzles/flat-klein-bottle"
}
