{
  "kind": "twisty-authoring-project",
  "projectVersion": 1,
  "id": "helicopter",
  "producer": {
    "type": "source",
    "package": "../../../packages/helicopter/package.json",
    "realizations": [
      {
        "id": "helicopter-euclidean",
        "path": "../../../packages/helicopter/helicopter-euclidean.json"
      },
      {
        "id": "helicopter-port-diagram",
        "path": "../../../packages/helicopter/helicopter-port-diagram.json"
      },
      {
        "id": "helicopter-spherical",
        "path": "../../../packages/helicopter/helicopter-spherical.json"
      }
    ]
  },
  "includeLegacy": false,
  "output": "../../../runtime-puzzles/helicopter",
  "presentation": {
    "version": 1,
    "defaultAlgorithm": "UF_ab UL_af",
    "instructions": "Stops a\u2013f \u00b7 buttons follow each grip\u2019s current phase"
  }
}
