{
  "kind": "twisty-authoring-project",
  "projectVersion": 1,
  "id": "melty-a",
  "producer": {
    "type": "source",
    "package": "../../../packages/melty-a/package.json",
    "realizations": [
      {
        "id": "melty-a-euclidean",
        "path": "../../../packages/melty-a/melty-a-euclidean.json"
      },
      {
        "id": "melty-a-port-diagram",
        "path": "../../../packages/melty-a/melty-a-port-diagram.json"
      },
      {
        "id": "melty-a-spherical",
        "path": "../../../packages/melty-a/melty-a-spherical.json"
      }
    ]
  },
  "includeLegacy": false,
  "output": "../../../runtime-puzzles/melty-a",
  "presentation": {
    "version": 1,
    "defaultAlgorithm": "U U'",
    "instructions": "Face keys U R F D L B \u00b7 choose each cap independently \u00b7 hover for angles"
  }
}
